assumption_id,name,assumption_type,source_artifact,source_path,source_sha256,allowed_simulator_use,forbidden_use,black_box_status,claim_status,assumption_version,promotion_status
SIM-BB-001,fixed_g900_body,fixed_theorem_body,G900 observatory body and existing transport registries,labs/g900_observatory/data/g900_admitted_information_transports.v0.1.json,2e1b4bc6e3ec072af260eb50af15ac8e21ba089be4b13039e5d101ca5941447f,The simulator may read the fixed G900 body/register state as its static substrate.,"May not mutate the G900 theorem body, add vertices, add edges, or claim geometry/physics from the body alone.",body_fixed_not_physics,not_physics_claim,black_box_assumption_version:SIM-BB-001.v0.1,assumption_only
SIM-BB-002,admitted_permission_channel_registry,receipt_backed_registry,g900_admitted_permission_channels.v0.1.json,labs/g900_observatory/data/g900_admitted_permission_channels.v0.1.json,94afd7ca8ffd171860b31d2c1ac2b55b21437fc69b8efc44c4a4bf27c0475964,The simulator may treat the current admitted permission channel count and records as fixed ledger inputs.,May not admit new permission channels or infer physical permission from simulator behavior.,registry_fixed,not_new_admission,black_box_assumption_version:SIM-BB-002.v0.1,assumption_only
SIM-BB-003,admitted_information_transport_registry,receipt_backed_registry,g900_admitted_information_transports.v0.1.json,labs/g900_observatory/data/g900_admitted_information_transports.v0.1.json,2e1b4bc6e3ec072af260eb50af15ac8e21ba089be4b13039e5d101ca5941447f,The simulator may use the single admitted finite information transport as a graph information-transfer primitive.,"May not reinterpret finite information transport as physical transport, energy flow, force, or flux.",registry_fixed,not_physics_claim,black_box_assumption_version:SIM-BB-003.v0.1,assumption_only
SIM-BB-004,f0001_return_hub_seam_plateau,bounded_plateau,g900_transport_choice_f0001_seam_plateau_checkpoint_057,labs/g900_observatory/artifacts/json/g900_transport_choice_f0001_seam_plateau_checkpoint_057.v1.json,71969f3c38f291fc47a7367661373aa8a0bb5e3ee0662c30541c3cafdf007aec,"The simulator may use the F0001 seam as visible, identifiable, role/cut handled, and pre-role fingerprinted.",May not treat the seam as generated by a constructive source law.,identifiable_not_generated,not_source_law,black_box_assumption_version:SIM-BB-004.v0.1,assumption_only
SIM-BB-005,f0001_generator_gap,known_unknown,g900_transport_choice_f0001_generator_definition_flag_056,labs/g900_observatory/artifacts/json/g900_transport_choice_f0001_generator_definition_flag_056.v1.json,31d143192e4c2e8e145e134634f5d509309ebc440a356bb9d0cb03e398cf5140,The simulator may label any F0001 seam behavior as black-boxed at the generator layer.,May not claim the missing pre-role seam generator has been solved by simulation output.,missing_pre_role_seam_generator,known_unknown,black_box_assumption_version:SIM-BB-005.v0.1,assumption_only
SIM-BB-006,pre_role_seam_fingerprint_surface,fingerprint_surface,g900_transport_choice_f0001_pre_role_seam_source_search_055,labs/g900_observatory/artifacts/json/g900_transport_choice_f0001_pre_role_seam_source_search_055.v1.json,3c650e4aeadf10c64f0f32a0d657b3271e6a21cc2c2643cb00ba304c1a24c3ec,The simulator may expose pre-role seam fingerprints as observables or diagnostic fields.,May not promote exact fingerprints to constructive causes.,fingerprint_not_generator,not_source_law,black_box_assumption_version:SIM-BB-006.v0.1,assumption_only
