summary_id,summary_name,count,interpretation,promotion_status
050-S1,endpoint_slot_universe_count,15,Slot endpoint universe tested for source-conditioned hub and leaf rules.,input
050-S2,anchor_count,4,Anchor hubs inherited from the 049 inner-tie profile.,context
050-S3,source_hub_count,1,Non-anchor endpoints with exactly two full-carrier neighbors in the anchor set.,not_promoted
050-S4,source_leaf_count,8,Non-anchor endpoints with one anchor neighbor or hub adjacency.,not_promoted
050-S5,source_omitted_count,2,Non-anchor endpoints with no anchor neighbor and no hub adjacency.,not_promoted
050-S6,predicted_carrier_count,14,"Boundary carriers reconstructed from anchor, hub, and leaf source roles.",not_promoted
050-S7,carrier_reconstruction_exact,1,Whether the conditional source roles reconstruct the 049 target carrier set.,not_promoted
050-S8,source_law_promotions,0,No source law is promoted.,locked
050-S9,admission_promotions,0,No permission channel or information transport is admitted.,locked
