summary_id,summary_name,count,interpretation,status
057-S1,checkpoint_artifact,1,A seam plateau checkpoint is recorded.,checkpoint_only
057-S2,phase_row_count,4,Seam phase rows included in the checkpoint.,input
057-S3,phase_pass_count,4,All phase rows passed.,locked
057-S4,visible_identifiable_fingerprinted,1,"F0001 seam is visible, identifiable, and pre-role fingerprinted.",positive_plateau
057-S5,generator_not_found_in_tested_family,1,No constructive generator is promoted in the tested family.,negative_plateau
057-S6,generator_definition_planted,1,The formal generator satisfaction definition is recorded by 056.,finish_line_defined
057-S7,source_law_promotions,0,This checkpoint promotes no source law.,locked
057-S8,family_promotions,0,This checkpoint promotes no transport family.,locked
057-S9,admission_promotions,0,This checkpoint admits no permission channel or information transport.,locked
