stage,artifact,status,result,admission_effect,keeper
025,g900_transport_permission_frontier_checkpoint_025,permission_frontier_reached_no_admission_law_found,"permission frontier reached, no admission law found",none,The apparatus found a permission frontier. It did not find an admission law.
026,g900_transport_permission_frontier_theorem_note_026,theorem_note_records_one_transport_plus_permission_frontier,one admitted transport plus permission frontier recorded,none,One transport is admitted. The frontier is real. The family is not yet earned.
027,g900_transport_frontier_choice_apparatus_protocol_027,discovery_layer_expanded_admission_layer_locked,"discovery layer expanded, admission layer locked",none,"Modify the lens, not the body. Expand discovery, not admission."
028,g900_transport_frontier_choice_variable_inventory_028,frontier_choice_variables_inventoried_from_rich_018b_source_conservative_quarantine_admission_locked,rich 018b choice variables inventoried with conservative quarantine,none,"Before choice can become law, the apparatus must know what choice can see."
029,g900_transport_frontier_choice_function_search_029,choice_hypotheses_found_no_admission,"choice hypotheses found, no admission",none,A choice function may nominate. Only provenance can promote.
030,g900_transport_frontier_choice_function_stress_test_030,choice_hypotheses_stress_tested_no_promotion,"choice hypotheses stress-tested, no promotion",none,A nominated choice must survive doubt before it can ask for law.
