candidate_id,candidate_name,description,hit_count,tested_count,exact_on_repeated_families,law_status
035-L1,selector_values_inside_role_endpoints,All selector values in the family are contained in the role-pair endpoint set.,77,87,false,descriptive_handle_not_source_law
035-L2,role_endpoints_equal_selector_values,The union of selector values equals the role-pair endpoint set.,66,87,false,descriptive_handle_not_source_law
035-L3,all_selector_value_sets_subset_endpoints,Every member selector value set is a subset of the family endpoint set.,77,87,false,descriptive_handle_not_source_law
035-L4,role_graph_is_tree,The role-pair tokens form a tree.,85,87,false,descriptive_handle_not_source_law
035-L5,role_graph_is_simple_path,The role-pair tokens form a simple path.,85,87,false,descriptive_handle_not_source_law
035-L6,all_members_razor_blocked,All members are razor-small and blocked as razor-small until proven.,38,87,false,blocker_pattern_not_source_law
035-L7,strong_descriptive_handle_no_law,"Endpoint equality, selector subset condition, and role tree all hold.",66,87,false,strong_description_not_construction_law
