summary_id,summary_name,count,interpretation,promotion_status
051-S1,endpoint_slot_universe_count,15,Endpoint slots tested for anchor source handles.,input
051-S2,target_anchor_count,4,Anchor target inherited from 050 for evaluation only.,evaluation_target
051-S3,slot14_incident_neighbor_count,4,Full-carrier neighbors of slot14.,profile_only
051-S4,slot14_strong_incident_neighbors_ge_180,3,Slot14 incident neighbors whose carrier has global root-smoke row count at least 180.,not_promoted
051-S5,slot14_presence_neighbors_ge_3,3,Slot14 incident neighbors whose carrier appears in at least three slot contexts.,not_promoted
051-S6,exact_nonquarantined_anchor_handle_count,3,Exact anchor handles not reading the target anchor label directly.,not_promoted
051-S7,source_law_promotions,0,No source law is promoted.,locked
051-S8,admission_promotions,0,No permission channel or information transport is admitted.,locked
