metric,value,meaning
frontier_row_count,71,deferred frontier rows entering candidate-specific gate audit
candidate_gate_ready_count,71,candidates satisfying the pre-admission gate audit package
candidate_gate_near_pass_count,0,candidates near passing the gate audit package
candidate_gate_failed_count,0,candidates failing the gate audit package
current_admitted_permission_channel_count,1,unchanged current ledger state
current_admitted_information_transport_count,1,unchanged current ledger state
