summary_id,summary_name,count,interpretation,promotion_status
042-S1,denied_full_cluster,1,Denied pair carries the full seven-term shell cluster in 041 matrix.,not_promoted
042-S2,allowed_full_cluster_count,0,Allowed pairs carrying the same full shell cluster.,not_promoted
042-S3,upstream_full_cluster_row_count,60,Upstream construction rows where all cluster terms co-occur.,co_visibility_not_rule
042-S4,upstream_lock_edge_row_count,798,Upstream construction rows mentioning the lock edge 04_05.,co_visibility_not_rule
042-S5,upstream_lock_with_outer_witness_row_count,216,Rows where the lock edge appears with 05_10 or 05_14 outer shell witness.,co_visibility_not_rule
042-S6,source_law_promotions,0,No source law is promoted.,locked
042-S7,admission_promotions,0,No permission channel or information transport is admitted.,locked
