component,color_metaphor,id,meaning,claim
fixed_body,black,g900_static_body,"fixed 900-vertex, 3600-edge body",support only
realization_path,green,return_cell_realization_path_010_green,R realizes P as Q,finite realization
signature_path,magenta,return_cell_conserved_signature_path_010_magenta,role_anchor_signature is conserved,conserved observable
crossing,crossing,return_cell_information_flux_crossing_010,realization and signature agree across h(0)->h(1),finite information flux witness
observer_path,cyan,observer_lens_readout_path,"readout trajectory or witness lens, not a body mutation",interpretive diagram grammar only
