step,name,statement,support,result
1,Ledger fixation,The current registries contain one admitted permission channel and one admitted information transport.,"registries, 026, 031",one admitted transport remains the ledger state
2,Frontier reality,The 71 deferred candidates are gate-ready and structurally real.,"016, 018b, 020, 027, 031",frontier is real but quarantined
3,Visibility quarantine,"The choice apparatus inventories visible fields while excluding identity, result, gate, replay, receipt, and admission-like fields.",028,12 usable structural choice variables remain
4,Choice nomination,A structural ABCDE search exposes 545 choice hypotheses and 317 non-singleton candidate hypotheses.,029,choice is visible
5,Doubt,The nominated hypotheses are attacked by sharpness and null/marginal stress tests.,030,no hypothesis is promoted
6,Conclusion,"The ledger supports one admitted transport plus an unpromoted frontier, not a transport family.",031 and this theorem note,admission remains locked
